{
  "schema_version": "usage-readiness-scientific-protocol-v1",
  "protocol_id": "cytoanvi-p2a-usage-readiness-v1",
  "model": "cytoanvi",
  "status": "draft_unfrozen",
  "artifact": {"version": "0.2.0", "wheel_sha256": null, "source_commit": null},
  "capabilities": [
    {
      "capability_id": "cytoanvi.core",
      "freeze_status": "draft_unfrozen",
      "cohorts": [{"id": "historical-primary-cohort", "role": "development_only", "independent": false}],
      "biological_unit": "donor",
      "split_and_leakage_boundary": null,
      "rng_streams": {"training_seeds": [0, 1, 2], "streams": {"split": "separate-unfrozen", "training": "seeded", "bootstrap": "separate-unfrozen"}},
      "compute_budget": null,
      "representation_semantics": ["backbone latent", "flat label probabilities"],
      "primary_endpoint": null,
      "numeric_margin": null,
      "donor_level_uncertainty": null,
      "multiplicity": null,
      "controls": {"positive": [], "negative": []},
      "no_call_policy": {"rule": "No scientific call until all blockers are frozen and independently approved."},
      "immutable_outputs": {"required": ["terminal manifest", "predictions", "donor-level metrics"]},
      "terminal_manifest_schema": "docs/artifacts/schemas/terminal-run-manifest.schema.json",
      "pre_run_review": "pending",
      "post_run_review": "not_run",
      "blockers": ["Exact 0.2.0 artifact identity is unavailable.", "Independent second cohort and target-label authority are missing.", "Split, compute budget, primary endpoint, numeric margin, uncertainty, multiplicity, and controls are unfrozen."]
    },
    {
      "capability_id": "cytoanvi.mapping.same_panel",
      "freeze_status": "draft_unfrozen",
      "cohorts": [{"id": "historical-primary-cohort", "role": "reference_query_development", "independent": false}],
      "biological_unit": "donor",
      "split_and_leakage_boundary": null,
      "rng_streams": {"training_seeds": [0, 1, 2], "streams": {"reference_query_split": "separate-unfrozen", "training": "seeded", "bootstrap": "separate-unfrozen"}},
      "compute_budget": null,
      "representation_semantics": ["same ordered marker panel", "query surgery latent", "transferred flat labels"],
      "primary_endpoint": null,
      "numeric_margin": null,
      "donor_level_uncertainty": null,
      "multiplicity": null,
      "controls": {"positive": [], "negative": []},
      "no_call_policy": {"rule": "Mapping agreement alone is not target-label accuracy; no call without independent query truth."},
      "immutable_outputs": {"required": ["terminal manifest", "reference/query split", "predictions", "marker order"]},
      "terminal_manifest_schema": "docs/artifacts/schemas/terminal-run-manifest.schema.json",
      "pre_run_review": "pending",
      "post_run_review": "not_run",
      "blockers": ["Independent query labels and second cohort are missing.", "Non-inferiority, rare-class recall, calibration/failure ceilings, controls, and compute budget are unfrozen.", "Exact artifact identity is unavailable."]
    },
    {
      "capability_id": "cytoanvi.mapping.panel_divergent",
      "freeze_status": "draft_unfrozen",
      "cohorts": [{"id": "historical-primary-cohort", "role": "panel_development", "independent": false}],
      "biological_unit": "donor",
      "split_and_leakage_boundary": null,
      "rng_streams": {"training_seeds": [0, 1, 2], "streams": {"panel_mask": "separate-unfrozen", "training": "seeded", "bootstrap": "separate-unfrozen"}},
      "compute_budget": null,
      "representation_semantics": ["declared shared backbone", "panel-specific nan mask", "query surgery latent"],
      "primary_endpoint": null,
      "numeric_margin": null,
      "donor_level_uncertainty": null,
      "multiplicity": null,
      "controls": {"positive": [], "negative": []},
      "no_call_policy": {"rule": "No call if the shared backbone, mask lineage, or independent query truth is absent."},
      "immutable_outputs": {"required": ["terminal manifest", "panel/backbone inventory", "nan-mask digest", "predictions"]},
      "terminal_manifest_schema": "docs/artifacts/schemas/terminal-run-manifest.schema.json",
      "pre_run_review": "pending",
      "post_run_review": "not_run",
      "blockers": ["Second-cohort panel authority and independent labels are missing.", "Backbone algorithm, margins, controls, uncertainty, and compute budget are unfrozen.", "Exact artifact identity is unavailable."]
    },
    {
      "capability_id": "cytoanvi.hierarchy",
      "freeze_status": "draft_unfrozen",
      "cohorts": [{"id": "historical-primary-cohort", "role": "hierarchy_development", "independent": false}],
      "biological_unit": "donor",
      "split_and_leakage_boundary": null,
      "rng_streams": {"training_seeds": [0, 1, 2], "streams": {"hierarchy": "separate-unfrozen", "training": "seeded", "bootstrap": "separate-unfrozen"}},
      "compute_budget": null,
      "representation_semantics": ["CytoANVI latent", "scHPL tree", "flat and hierarchical labels"],
      "primary_endpoint": null,
      "numeric_margin": null,
      "donor_level_uncertainty": null,
      "multiplicity": null,
      "controls": {"positive": [], "negative": []},
      "no_call_policy": {"rule": "Synthetic fake-scHPL execution is engineering evidence only and cannot support a biological call."},
      "immutable_outputs": {"required": ["terminal manifest", "tree", "label mapping", "donor metrics"]},
      "terminal_manifest_schema": "docs/artifacts/schemas/terminal-run-manifest.schema.json",
      "pre_run_review": "pending",
      "post_run_review": "not_run",
      "blockers": ["Independent ontology/label authority and second cohort are missing.", "Hierarchy endpoint, margin, controls, uncertainty, and compute budget are unfrozen.", "External notebook submodule repair is blocked and artifact identity is unavailable."]
    },
    {
      "capability_id": "cytoanvi.integration_clustering",
      "freeze_status": "draft_unfrozen",
      "cohorts": [{"id": "historical-primary-cohort", "role": "integration_development", "independent": false}],
      "biological_unit": "donor",
      "split_and_leakage_boundary": null,
      "rng_streams": {"training_seeds": [0, 1, 2], "streams": {"training": "seeded", "neighbors_clustering": "separate-unfrozen", "bootstrap": "separate-unfrozen"}},
      "compute_budget": null,
      "representation_semantics": ["backbone latent", "neighbor graph", "cluster assignments"],
      "primary_endpoint": null,
      "numeric_margin": null,
      "donor_level_uncertainty": null,
      "multiplicity": null,
      "controls": {"positive": [], "negative": []},
      "no_call_policy": {"rule": "No call from UMAP or a single clustering resolution; biology and batch endpoints must both be frozen."},
      "immutable_outputs": {"required": ["terminal manifest", "latent", "graph", "clusters", "donor metrics"]},
      "terminal_manifest_schema": "docs/artifacts/schemas/terminal-run-manifest.schema.json",
      "pre_run_review": "pending",
      "post_run_review": "not_run",
      "blockers": ["Independent second cohort is missing.", "Graph/clustering operating points, endpoints, margins, controls, multiplicity, and uncertainty are unfrozen.", "Exact artifact identity is unavailable."]
    },
    {
      "capability_id": "cytoanvi.tta_ood",
      "freeze_status": "blocked",
      "cohorts": [{"id": "historical-roider-evaluation", "role": "negative_evidence", "independent": false}],
      "biological_unit": "donor",
      "split_and_leakage_boundary": null,
      "rng_streams": {"training_seeds": [0, 1, 2], "streams": {"training": "seeded", "tta_mask": "counter_based", "operating_point": "separate-unfrozen"}},
      "compute_budget": null,
      "representation_semantics": ["historical experimental TTA score", "external latent-distance comparator"],
      "primary_endpoint": null,
      "numeric_margin": null,
      "donor_level_uncertainty": null,
      "multiplicity": null,
      "controls": {"positive": [], "negative": []},
      "no_call_policy": {"rule": "Stable API remains no-go; below-chance historical TTA cannot be promoted or tuned post hoc."},
      "immutable_outputs": {"required": ["terminal manifest", "scores", "OOD truth", "operating point"]},
      "terminal_manifest_schema": "docs/artifacts/schemas/terminal-run-manifest.schema.json",
      "pre_run_review": "pending",
      "post_run_review": "not_run",
      "blockers": ["Historical TTA evidence is negative.", "Replacement algorithm, independent OOD truth, baseline-improvement margin, operating-point error limits, controls, and second cohort are unfrozen.", "Exact artifact identity is unavailable."]
    },
    {
      "capability_id": "cytoanvi.continual",
      "freeze_status": "blocked",
      "cohorts": [{"id": "historical-primary-cohort", "role": "continual_development", "independent": false}],
      "biological_unit": "donor",
      "split_and_leakage_boundary": null,
      "rng_streams": {"training_seeds": [0, 1, 2], "streams": {"training": "seeded", "replay_selection": "predeclared-unfrozen", "control_assignment": "separate-unfrozen"}},
      "compute_budget": null,
      "representation_semantics": ["reference replay", "query update", "external matched control"],
      "primary_endpoint": null,
      "numeric_margin": null,
      "donor_level_uncertainty": null,
      "multiplicity": null,
      "controls": {"positive": [], "negative": []},
      "no_call_policy": {"rule": "No consequential update without replay and external control; replay-less and uncertainty-selected stable paths refuse."},
      "immutable_outputs": {"required": ["terminal manifest", "replay IDs", "control IDs", "before/after metrics"]},
      "terminal_manifest_schema": "docs/artifacts/schemas/terminal-run-manifest.schema.json",
      "pre_run_review": "pending",
      "post_run_review": "not_run",